timestamp	iteration	model	action	factor_name	category	score	delta	sharpe	excess_return	ic_ir	status	hypothesis
2026-04-09T02:56:44.072329	27	qwen3.5-plus	NEW_FACTOR	evolved_035_cross_asset_vol_leadership_reg	regime	0.268427	-0.012151	1.2867	0.0846	0.0000	DISCARDED	跨资产波动率领导权（哪类资产主导市场波动）包含独立的制度转换信息——当进攻型资产主导波动率扩张时表明风险偏好不稳定但仍活跃，当防御型资产主导波动率时表明真正的风险规避压力；这与绝对波动率水平、相关性变化和动量信号正交，能识别"波动率来源"的
2026-04-09T02:57:36.749247	28	qwen3.5-plus	NEW_FACTOR	evolved_036_offensive_momentum_synchroniza	regime	0.238164	-0.042414	1.2490	0.0777	0.0000	DISCARDED	进攻型资产动量的同步性（所有进攻资产动量方向的一致性）包含独立的市场健康度信息——当所有进攻资产动量同向时表明趋势有广泛基础、更可持续；当动量方向分化时表明市场内部存在分歧、趋势脆弱。这与动量强度（幅度）、趋势一致性（个体价格路径）和相关性
2026-04-09T02:59:19.605729	29	qwen3.5-plus	NEW_FACTOR	evolved_037_gold_leading_regime	regime	0.243767	-0.036811	1.2382	0.0791	0.0000	DISCARDED	GLD 动量变化对股市风险偏好具有领先预测能力——黄金走强预示通胀/货币担忧上升（应保守），黄金走弱预示风险偏好改善（可进攻），这与 TLT 领先信号正交（TLT 捕捉增长/利率担忧，GLD 捕捉通胀/货币担忧）。
2026-04-09T03:02:31.714012	30	qwen3.5-plus	NEW_FACTOR	evolved_038_offensive_momentum_rank_accele	offensive	0.227548	-0.053030	1.2915	0.0655	0.0322	DISCARDED	进攻型资产的动量排名变化率（排名加速度）包含独立的趋势健康度信息——排名持续上升的资产表明机构资金持续流入、相对强度增强；排名持续下降表明资金流出、相对强度减弱。这与绝对动量强度（变化幅度）、趋势一致性（价格路径）和动量同步性（方向一致性）
2026-04-09T03:03:06.814055	31	qwen3.5-plus	NEW_FACTOR	CRASH		0.000000	0.000000	0.0000	0.0000	0.0000	CRASH	ERROR: Factor failed: .15/lib/python3.11/site-packages/pandas/core/generic.py", line 11889, in _min_count_s
2026-04-09T03:03:38.077378	32	qwen3.5-plus	NEW_FACTOR	evolved_040_defensive_relative_rotation	defensive	0.280578	0.000000	1.3034	0.0873	-0.1773	DISCARDED	防御型资产内部的相对强度轮动包含独立的配置信息——不同风险类型（通缩、通胀、流动性危机）下最优防御资产不同，动态捕捉防御资产间的相对动量能帮助策略在风险规避期选择更合适的防御工具，与绝对防御评分和防御领先持续性正交。
2026-04-09T03:04:29.699451	33	qwen3.5-plus	NEW_FACTOR	CRASH		0.000000	0.000000	0.0000	0.0000	0.0000	CRASH	ERROR: Factor failed: Traceback (most recent call last):   File "/var/folders/6r/3lr3yl1j7cq5blns8b8yb73c00
2026-04-09T03:05:22.021363	34	qwen3.5-plus	NEW_FACTOR	evolved_042_evolved_041_offensive_risk_con	regime	0.221760	-0.058818	1.2285	0.0723	0.0000	DISCARDED	进攻型资产内部的风险集中度（QQQ 相对 SPY 的超额动量）包含独立的制度信号——当科技股大幅跑赢大盘时表明风险偏好过度集中、市场脆弱；当大盘相对科技股走强时表明风险偏好更广泛可持续，这与跨资产进攻/防御关系正交。
2026-04-09T03:06:34.656226	35	qwen3.5-plus	NEW_FACTOR	CRASH		0.000000	0.000000	0.0000	0.0000	0.0000	CRASH	ERROR: Factor failed: Traceback (most recent call last):   File "/var/folders/6r/3lr3yl1j7cq5blns8b8yb73c00
2026-04-09T03:07:10.429312	36	qwen3.5-plus	NEW_FACTOR	evolved_044_evolved_043_defensive_vol_rati	regime	0.287202	0.006624	1.3126	0.0888	0.0000	KEPT	防御型资产（TLT vs GLD）的相对波动率比率包含独立的宏观风险类型信息——当 TLT 波动率相对 GLD 更高时，市场担忧通缩/增长风险；当 GLD 波动率相对 TLT 更高时，市场担忧通胀/货币风险。这种"风险类型"信号与绝对波动率
2026-04-09T03:09:27.882400	37	qwen3.5-plus	NEW_FACTOR	evolved_045_offensive_vol_asymmetry	offensive	0.104630	-0.182572	1.1255	0.0431	-0.6910	DISCARDED	进攻型资产在下跌日的波动率相对上涨日波动率的比率包含独立的风险信号——当下跌波动率显著高于上涨波动率时，表明市场存在"下跌恐惧"、卖压不对称，即使平均波动率不高也预示风险；当上涨波动率主导时，表明健康的需求驱动上涨。这与绝对波动率水平、动量
2026-04-09T03:10:12.897049	38	qwen3.5-plus	NEW_FACTOR	evolved_046_offensive_tlt_correlation_regi	regime	0.287202	0.000000	1.3126	0.0888	0.0000	DISCARDED	进攻型资产与 TLT 的相关性包含独立的风险制度信息——正常环境下股票与国债负相关（风险偏好清晰），当相关性上升至零或正值时，表明市场处于异常状态（如流动性危机中股债双杀，或滞胀担忧），这比绝对波动率或相关性变化速度更能捕捉"相关性制度"本
2026-04-09T03:11:34.985222	39	qwen3.5-plus	NEW_FACTOR	evolved_047_defensive_momentum_term_struct	defensive	0.287202	0.000000	1.3126	0.0888	-0.3516	DISCARDED	防御型资产的动量期限结构包含独立的配置时机信息——当短期动量显著强于长期动量时，表明避险需求正在加速上升（应增配防御）；当短期动量弱于长期动量时，表明避险需求正在衰减（应减配防御）。这与绝对防御评分（静态）和防御领先持续性（相对进攻型）正交
2026-04-09T03:12:25.332268	40	qwen3.5-plus	NEW_FACTOR	evolved_048_offensive_defensive_spread_vol	regime	0.287202	0.000000	1.3126	0.0888	0.0000	DISCARDED	进攻型与防御型资产收益差的波动率包含独立的制度稳定性信息——当进攻/防御收益差波动剧烈时，表明风险溢价不稳定、市场在风险偏好间快速摇摆，应保守；当收益差波动稳定时，表明风险制度清晰、可更积极配置进攻资产。这与绝对波动率、相关性变化和防御领先
2026-04-09T03:13:06.900294	41	qwen3.5-plus	NEW_FACTOR	evolved_049_offensive_upside_capture_asymm	offensive	0.238069	-0.049133	1.1465	0.0771	-0.3692	DISCARDED	进攻型资产的上行/下行捕获率不对称性包含独立的风险收益特征信息——当资产在基准上涨时参与度高、基准下跌时参与度低时，表明该资产具有"涨多跌少"的优质特征；这与绝对动量（变化幅度）、趋势一致性（上涨日比例）和波动率不对称性（涨跌日波动率比）正
2026-04-09T03:13:56.823944	42	qwen3.5-plus	NEW_FACTOR	evolved_050_offensive_multi_horizon_moment	offensive	0.274612	-0.012590	1.3047	0.0863	-1.6765	DISCARDED	进攻型资产在多时间窗口动量方向一致时，趋势更具持续性——当短期、中期、长期动量同向时表明不同周期资金共识强，趋势可信度高；当动量方向分歧时表明周期错配、趋势脆弱。这与单窗口动量强度、动量加速度、趋势一致性（上涨日比例）正交，提供"时间维度共
2026-04-09T03:14:25.361794	43	qwen3.5-plus	NEW_FACTOR	evolved_051_evolved_051_offensive_intraday	offensive	0.198980	-0.088222	1.1935	0.0681	-0.9525	DISCARDED	资产收盘价在日内高低点区间的位置（close-to-range position）反映持续的买卖压力——当资产持续在日内高位收盘时表明买盘贯穿全天、趋势健康；当持续在低位收盘时表明卖压持续、趋势脆弱。这与绝对收益（可以平盘但收盘位置不同）、
2026-04-09T03:15:30.173357	44	qwen3.5-plus	NEW_FACTOR	CRASH		0.000000	0.000000	0.0000	0.0000	0.0000	CRASH	ERROR: Factor failed: Traceback (most recent call last):   File "/var/folders/6r/3lr3yl1j7cq5blns8b8yb73c00
2026-04-09T03:16:11.975549	45	qwen3.5-plus	NEW_FACTOR	evolved_053_evolved_054_offensive_momentum	regime	0.287202	0.000000	1.3126	0.0888	0.0000	DISCARDED	进攻型资产内部动量离散度（momentum dispersion）反映市场共识程度——当所有进攻资产动量接近时表明市场方向明确、趋势可信；当动量高度离散时表明资金分歧大、市场处于过渡期、应更保守。这与相关性速度、动量同步性（方向一致性）和波
2026-04-09T03:17:30.264737	46	qwen3.5-plus	NEW_FACTOR	evolved_054_range_expansion_momentum	offensive	0.292429	0.005227	1.3184	0.0903	-1.0338	KEPT	交易区间扩张（高低价差扩大） после 压缩期表明机构活动增加，往往先于持续性方向突破——这与基于收益率的波动率因子正交（区间可以宽但收盘接近，或区间窄但跳空），提供"能量积蓄"的独立信号。
2026-04-09T03:18:01.438664	47	qwen3.5-plus	NEW_FACTOR	evolved_055_volume_confirmed_momentum	offensive	0.263568	-0.028861	1.2633	0.0834	-1.0014	DISCARDED	成交量确认的价格动量包含独立的信息——当价格上涨伴随高成交量时表明机构资金参与、趋势可信；当价格上涨但成交量低迷时表明缺乏参与、趋势脆弱。这与纯价格动量、波动率和趋势一致性因子正交，提供"资金参与度"维度。
2026-04-09T03:18:56.419549	48	qwen3.5-plus	NEW_FACTOR	evolved_056_offensive_gap_fill_resistance	offensive	0.093641	-0.198788	1.1304	0.0377	0.0084	DISCARDED	进攻型资产对隔夜缺口的抵抗能力包含独立的趋势健康度信息——当资产跳空后价格不回填缺口时，表明机构资金共识强、趋势可信；当缺口快速被回填时，表明缺乏持续买盘/卖盘、趋势脆弱。这与动量强度（收益幅度）、趋势一致性（上涨日比例）和日内收盘位置（e
2026-04-09T03:19:48.693619	49	qwen3.5-plus	NEW_FACTOR	evolved_057_volatility_autocorrelation_reg	regime	0.276861	-0.015568	1.3078	0.0860	0.0000	DISCARDED	波动率的自相关性（波动率聚集程度）包含独立的市场稳定性信息——当波动率高度自相关时（高波动日后继续高波动），表明市场处于稳定的波动制度中，趋势更可预测；当波动率自相关性低时，表明波动制度不稳定、市场处于过渡期，应更保守。这与绝对波动率水平、
2026-04-09T03:20:53.918833	50	qwen3.5-plus	NEW_FACTOR	evolved_058_offensive_momentum_stability	offensive	0.054284	-0.238145	1.0160	0.0314	-0.3109	DISCARDED	进攻型资产动量信号的稳定性（动量序列自身的波动率）包含独立的趋势质量信息——当动量值稳定时表明趋势有持续资金推动、可信度高；当动量值剧烈波动时表明资金流向不稳定、趋势易反转。这与动量强度（幅度）、趋势一致性（上涨日比例）和动量加速度（变化率
